{
  "id": "frontend.css-layout.topic-flex-grid",
  "domain": "frontend",
  "category": "css-layout",
  "group": "css-layout",
  "title": "Flex与Grid布局",
  "summary": "掌握Flexbox一维布局和Grid二维布局的核心属性，能够使用Flex和Grid实现常见的页面布局方案。",
  "tags": [
    "前端",
    "CSS",
    "Flex",
    "Grid",
    "布局"
  ],
  "difficulty": 2,
  "estimatedMinutes": 10,
  "order": 20,
  "recommendWeight": 85,
  "status": "draft",
  "learningCards": [
    {
      "type": "explain",
      "title": "知识全景",
      "content": "## Flex布局（一维）\n\n### 容器属性\n- `flex-direction`：主轴方向（row/column/row-reverse/column-reverse）\n- `justify-content`：主轴对齐（flex-start/center/flex-end/space-between/space-around/space-evenly）\n- `align-items`：交叉轴对齐（flex-start/center/flex-end/stretch/baseline）\n- `flex-wrap`：是否换行（nowrap/wrap/wrap-reverse）\n- `gap`：子元素间距\n\n### 子项属性\n- `flex-grow`：放大比例（默认0不放大）\n- `flex-shrink`：缩小比例（默认1可缩小）\n- `flex-basis`：初始大小（默认auto）\n- `flex`：简写（grow shrink basis）\n- `align-self`：单独设置交叉轴对齐\n- `order`：排列顺序\n\n## Grid布局（二维）\n\n### 容器属性\n- `grid-template-columns/rows`：定义行列轨道\n- `grid-template-areas`：命名区域\n- `gap`：行列间距\n- `justify-items/align-items`：单元格内对齐\n- `justify-content/align-content`：整体对齐\n\n### 子项属性\n- `grid-column/row`：跨越行列\n- `grid-area`：指定区域\n- `justify-self/align-self`：单独对齐"
    },
    {
      "type": "code",
      "title": "代码示例",
      "content": "/* Flex经典布局 */\n\n/* 水平垂直居中 */\n.center {\n  display: flex;\n  justify-content: center;\n  align-items: center;\n}\n\n/* 等分三栏 */\n.three-cols {\n  display: flex;\n  gap: 16px;\n}\n.three-cols > * {\n  flex: 1;\n}\n\n/* 固定+自适应两栏 */\n.sidebar-layout {\n  display: flex;\n}\n.sidebar-layout .sidebar {\n  width: 240px;\n  flex-shrink: 0;\n}\n.sidebar-layout .main {\n  flex: 1;\n}\n\n/* 底部固定 */\n.sticky-footer {\n  display: flex;\n  flex-direction: column;\n  min-height: 100vh;\n}\n.sticky-footer .content {\n  flex: 1;\n}\n\n/* Grid经典布局 */\n\n/* 圣杯布局 */\nholy-grail {\n  display: grid;\n  grid-template:\n    \"header header header\" auto\n    \"nav    main   aside\" 1fr\n    \"footer footer footer\" auto\n    / 200px 1fr 200px;\n  min-height: 100vh;\n}\n.holy-grail .header { grid-area: header; }\n.holy-grail .nav { grid-area: nav; }\n.holy-grail .main { grid-area: main; }\n.holy-grail .aside { grid-area: aside; }\n.holy-grail .footer { grid-area: footer; }\n\n/* 响应式卡片网格 */\n.card-grid {\n  display: grid;\n  grid-template-columns: repeat(auto-fill, minmax(280px, 1fr));\n  gap: 24px;\n}\n\n/* Grid + Flex组合 */\n.dashboard {\n  display: grid;\n  grid-template-columns: 240px 1fr;\n  grid-template-rows: 60px 1fr;\n  grid-template-areas:\n    \"sidebar header\"\n    \"sidebar main\";\n  height: 100vh;\n}\n.dashboard .header {\n  grid-area: header;\n  display: flex;\n  justify-content: space-between;\n  align-items: center;\n}",
      "language": "css"
    },
    {
      "type": "interviewAnswer",
      "title": "面试回答模板",
      "content": "Flex是一维布局，沿主轴排列子元素。核心属性有flex-direction决定主轴方向，justify-content控制主轴对齐，align-items控制交叉轴对齐。子项通过flex-grow/shrink/basis控制伸缩。常用的flex: 1相当于flex: 1 1 0%，表示等分剩余空间。\n\nGrid是二维布局，同时控制行和列。通过grid-template-columns/rows定义轨道大小，grid-template-areas定义命名区域。repeat(auto-fill, minmax(280px, 1fr))可以实现响应式卡片网格，自动填充尽可能多的列。\n\n两者的选择：一维排列用Flex，二维网格用Grid。实际项目中经常组合使用，比如Grid做整体页面框架，Flex做局部元素排列。",
      "followUpQuestions": [
        {
          "question": "在实际前端项目中，Flex与Grid布局的最佳实践是什么？有哪些常见的坑？",
          "answer": "Flex与Grid布局的核心是理解浏览器/Node.js的运行机制。建议通过Chrome DevTools的Performance面板和Sources面板实际调试。"
        },
        {
          "question": "Flex与Grid布局 的核心原理是什么？和其他方案相比有什么优劣？",
          "answer": "Flex与Grid布局 的核心原理涉及浏览器渲染引擎、JavaScript 运行时、网络协议等底层知识。理解原理有助于在不同方案间做出合理选择，也能在遇到问题时快速定位根因。"
        },
        {
          "question": "如果 Flex与Grid布局 在生产环境出了性能或兼容性问题，你会怎么排查？",
          "answer": "排查 Flex与Grid布局 问题的思路：先看浏览器兼容性数据和用户环境分布，再用 DevTools 的 Network/Performance/Console 面板定位。对于跨平台问题，需要在不同设备和浏览器上复现。监控平台的错误日志和性能数据是重要的线索。"
        }
      ]
    },
    {
      "type": "compareTable",
      "title": "对比与边界",
      "content": "| 维度 | Flex | Grid |\n| --- | --- | --- |\n| 布局维度 | 一维（行或列） | 二维（行和列） |\n| 排列方式 | 基于内容流 | 基于网格轨道 |\n| 对齐方式 | 主轴+交叉轴 | 行轴+列轴+单元格 |\n| 适用场景 | 导航栏、工具栏、等分布局 | 网格卡片、圣杯布局、仪表盘 |\n| 子项控制 | flex-grow/shrink/basis | grid-column/row跨越 |\n| 间距 | gap | gap（行和列分别设置） |\n| 学习曲线 | 中等 | 较高 |\n| 浏览器支持 | 完善 | 完善 |"
    },
    {
      "type": "diagram",
      "title": "结构图解",
      "content": "Flex主轴与交叉轴：flex-direction决定主轴方向，justify-content沿主轴分布，align-items沿交叉轴对齐。Grid由行轨道和列轨道组成网格，子项可跨越多个单元格。",
      "fallback": "Flex：主轴(horizontal)→justify-content，交叉轴(vertical)→align-items。Grid：列轨道(column tracks)×行轨道(row tracks)=网格单元格(grid cells)。",
      "items": [
        "Flex主轴方向由flex-direction决定",
        "Flex交叉轴垂直于主轴",
        "Grid行轨道和列轨道组成网格",
        "Grid子项可跨越多个行列",
        "两者可组合使用实现复杂布局"
      ]
    },
    {
      "type": "checklist",
      "title": "学完后应能说清楚",
      "items": [
        "Flex的核心容器属性和子项属性",
        "flex: 1的含义（flex-grow:1 flex-shrink:1 flex-basis:0%）",
        "Grid的grid-template-columns/rows和grid-template-areas用法",
        "repeat(auto-fill, minmax())实现响应式网格",
        "Flex和Grid的使用场景区别"
      ]
    }
  ],
  "recallPrompts": [
    {
      "id": "frontend.css-layout.topic-flex-grid.recall.1",
      "prompt": "flex: 1代表什么？flex-grow、flex-shrink、flex-basis分别是什么？",
      "mode": "text",
      "expectedMinutes": 3,
      "difficulty": 2
    },
    {
      "id": "frontend.css-layout.topic-flex-grid.recall.2",
      "prompt": "如何用CSS Grid实现响应式卡片网格？repeat(auto-fill, minmax())怎么工作？",
      "mode": "text",
      "expectedMinutes": 3,
      "difficulty": 2
    }
  ],
  "rubric": {
    "mustHave": [
      "能解释Flex的主轴和交叉轴概念",
      "能说出flex: 1的完整含义",
      "能用Grid实现圣杯布局",
      "能解释repeat(auto-fill, minmax())的响应式原理",
      "能说出Flex和Grid的适用场景区别"
    ],
    "goodToHave": [
      "能解释flex-basis和width的优先级关系",
      "能解释Grid的fr单位和minmax函数",
      "能实现复杂的Grid命名区域布局"
    ],
    "commonMistakes": [
      "对浏览器/Node.js运行机制理解不深入",
      "不能手写核心实现",
      "不知道如何排查前端性能问题"
    ],
    "scoreWeights": {
      "coverage": 35,
      "accuracy": 30,
      "interviewExpression": 20,
      "depth": 15
    }
  },
  "prerequisites": [
    "frontend.css-layout.topic-box-model-bfc"
  ],
  "interviewFrequency": "medium",
  "interviewerFocus": "考察前端基础功底，是否理解浏览器/JS引擎的工作机制，能否手写核心实现"
}
