{
  "id": "frontend.frontend-architecture.topic-frontend-router",
  "domain": "frontend",
  "category": "frontend-architecture",
  "group": "frontend-architecture",
  "title": "前端路由原理",
  "summary": "理解Hash路由和History路由的工作原理，掌握路由守卫机制和路由懒加载的实现。",
  "tags": [
    "前端",
    "架构",
    "路由",
    "Hash",
    "History"
  ],
  "difficulty": 2,
  "estimatedMinutes": 20,
  "order": 40,
  "recommendWeight": 80,
  "status": "draft",
  "learningCards": [
    {
      "type": "explain",
      "title": "知识全景",
      "content": "## 前端路由原理\n\n### Hash路由\n- URL中#后面的部分\n- hashchange事件监听变化\n- 不会发送到服务器\n- 兼容性好\n\n### History路由\n- 使用History API（pushState/replaceState）\n- URL更美观（无#）\n- 需要服务器配置支持\n- popstate事件监听浏览器前进/后退\n\n### 路由守卫\n- 全局守卫：所有路由生效\n- 路由独享：单个路由配置\n- 组件内：组件级别控制\n\n### 路由懒加载\n- 动态import()按需加载路由组件\n- 减少首屏加载体积\n- 配合Suspense显示loading"
    },
    {
      "type": "code",
      "title": "代码示例",
      "content": "// Hash路由实现\nclass HashRouter {\n  constructor() {\n    this.routes = {};\n    window.addEventListener('hashchange', () => this.resolve());\n    window.addEventListener('load', () => this.resolve());\n  }\n\n  route(path, callback) {\n    this.routes[path] = callback;\n  }\n\n  resolve() {\n    const hash = window.location.hash.slice(1) || '/';\n    const handler = this.routes[hash];\n    if (handler) handler();\n  }\n\n  navigate(path) {\n    window.location.hash = path;\n  }\n}\n\n// History路由实现\nclass HistoryRouter {\n  constructor() {\n    this.routes = {};\n    window.addEventListener('popstate', () => this.resolve());\n  }\n\n  route(path, callback) {\n    this.routes[path] = callback;\n  }\n\n  resolve() {\n    const path = window.location.pathname;\n    const handler = this.routes[path];\n    if (handler) handler();\n  }\n\n  navigate(path) {\n    window.history.pushState(null, '', path);\n    this.resolve();\n  }\n}\n\n// 路由懒加载\nimport { lazy, Suspense } from 'react';\n\nconst routes = [\n  { path: '/', component: lazy(() => import('./pages/Home')) },\n  { path: '/about', component: lazy(() => import('./pages/About')) },\n  { path: '/user/:id', component: lazy(() => import('./pages/User')) }\n];\n\nfunction App() {\n  return (\n    <Suspense fallback={<div>Loading...</div>}>\n      <Routes>\n        {routes.map(({ path, component: Component }) => (\n          <Route key={path} path={path} element={<Component />} />\n        ))}\n      </Routes>\n    </Suspense>\n  );\n}\n\n// 路由守卫（React Router v6）\nfunction PrivateRoute({ children }) {\n  const isAuth = useAuth();\n  const location = useLocation();\n\n  if (!isAuth) {\n    return <Navigate to=\"/login\" state={{ from: location }} replace />;\n  }\n  return children;\n}\n\n// 使用\n<Route path=\"/dashboard\" element={\n  <PrivateRoute>\n    <Dashboard />\n  </PrivateRoute>\n} />\n\n// Vue Router路由守卫\nrouter.beforeEach((to, from) => {\n  if (to.meta.requiresAuth && !isAuthenticated()) {\n    return '/login';\n  }\n});",
      "language": "javascript"
    },
    {
      "type": "interviewAnswer",
      "title": "面试回答模板",
      "content": "前端路由有两种实现方式：Hash路由监听hashchange事件，URL中#后面的部分变化不会发送到服务器，兼容性好；History路由使用pushState/replaceState API，URL更美观，但需要服务器配置支持，否则刷新会404。\n\n路由守卫控制页面访问权限。全局守卫对所有路由生效，常用于登录验证；路由独享守卫在路由配置中定义；组件内守卫在组件层面控制，比如提醒用户保存未提交的表单。\n\n路由懒加载通过动态import()实现，配合React.lazy/Suspense或Vue的defineAsyncComponent，按需加载路由组件，减少首屏加载体积。"
    },
    {
      "type": "compareTable",
      "title": "对比与边界",
      "content": "| 维度 | Hash路由 | History路由 |\n| --- | --- | --- |\n| URL格式 | /#/path | /path |\n| 监听事件 | hashchange | popstate |\n| 服务器配置 | 不需要 | 需要配置fallback |\n| 美观度 | 较差 | 好 |\n| 兼容性 | IE8+ | IE10+ |\n| SEO | 不友好 | 友好 |\n| 使用场景 | 兼容性要求高 | 现代项目 |"
    },
    {
      "type": "diagram",
      "title": "结构图解",
      "content": "前端路由工作原理：URL变化 → 路由器匹配路由表 → 加载对应组件 → 渲染到页面。Hash路由通过hashchange监听，History路由通过popstate监听。",
      "fallback": "URL变化 → 路由器 → 匹配路由表 → 加载组件 → 渲染。Hash: hashchange事件；History: pushState+popstate事件。",
      "items": [
        "URL变化触发路由匹配",
        "路由器维护路由表",
        "匹配成功加载对应组件",
        "组件渲染到指定位置",
        "路由守卫控制访问权限"
      ]
    },
    {
      "type": "checklist",
      "title": "学完后应能说清楚",
      "items": [
        "Hash路由和History路由的实现原理",
        "两种路由方式的优缺点",
        "路由守卫的类型和执行顺序",
        "路由懒加载的实现方式",
        "History路由的服务器配置要求"
      ]
    }
  ],
  "recallPrompts": [
    {
      "id": "frontend.frontend-architecture.topic-frontend-router.recall.1",
      "prompt": "Hash路由和History路由有什么区别？各自如何实现？",
      "mode": "text",
      "expectedMinutes": 3,
      "difficulty": 2
    },
    {
      "id": "frontend.frontend-architecture.topic-frontend-router.recall.2",
      "prompt": "如何实现路由守卫和路由懒加载？",
      "mode": "text",
      "expectedMinutes": 3,
      "difficulty": 2
    }
  ],
  "rubric": {
    "mustHave": [
      "能解释Hash路由和History路由的原理",
      "能说出两种路由的优缺点",
      "能实现简单的路由守卫",
      "能实现路由懒加载",
      "能解释History路由的服务器配置"
    ],
    "goodToHave": [
      "能手写简化版Hash路由",
      "能解释pushState和replaceState的区别",
      "能解释路由匹配算法"
    ],
    "commonMistakes": [
      "History路由不配置服务器fallback",
      "混淆hashchange和popstate事件",
      "路由懒加载不配合Suspense使用"
    ],
    "scoreWeights": {
      "coverage": 40,
      "accuracy": 25,
      "interviewExpression": 20,
      "depth": 15
    }
  }
}
