{
  "id": "design-pattern.creational.topic-jian-zao-zhe-mo-shi",
  "domain": "design-pattern",
  "category": "creational",
  "group": "creational",
  "title": "建造者模式",
  "summary": "通过分步构建复杂对象，将构建过程与表示分离，适合创建具有多个参数的对象。",
  "tags": [
    "设计模式",
    "创建型模式",
    "建造者模式"
  ],
  "difficulty": 2,
  "estimatedMinutes": 10,
  "order": 30,
  "recommendWeight": 70,
  "status": "staging",
  "learningCards": [
    {
      "type": "explain",
      "title": "知识全景",
      "content": "建造者模式将复杂对象的构建过程分解为多个步骤，通过链式调用逐步构建对象。它解决了构造函数参数过多的问题，提高了代码可读性。\n\n建造者模式的关键要素：\n1. **产品类**：最终要创建的复杂对象\n2. **抽象建造者**：定义构建产品的抽象步骤\n3. **具体建造者**：实现构建步骤，提供获取产品的方法\n4. **指挥者**：控制构建过程（可选）\n\n典型应用：StringBuilder、Lombok@Builder、Stream.Builder、Guava ImmutableSet.Builder等。"
    },
    {
      "type": "code",
      "title": "代码示例",
      "content": "// 1. 传统建造者模式\npublic class User {\n    private final String name;\n    private final int age;\n    private final String email;\n    \n    private User(Builder builder) {\n        this.name = builder.name;\n        this.age = builder.age;\n        this.email = builder.email;\n    }\n    \n    public static class Builder {\n        private String name;\n        private int age;\n        private String email;\n        \n        public Builder name(String name) {\n            this.name = name;\n            return this;\n        }\n        \n        public Builder age(int age) {\n            this.age = age;\n            return this;\n        }\n        \n        public Builder email(String email) {\n            this.email = email;\n            return this;\n        }\n        \n        public User build() {\n            return new User(this);\n        }\n    }\n}\n\n// 使用方式\nUser user = new User.Builder()\n    .name(\"张三\")\n    .age(25)\n    .email(\"zhangsan@example.com\")\n    .build();\n\n// 2. Lombok @Builder\n@Builder\npublic class UserLombok {\n    private String name;\n    private int age;\n    private String email;\n}\n\n// 3. 不可变对象构建\npublic final class ImmutableUser {\n    private final String name;\n    private final int age;\n    \n    private ImmutableUser(String name, int age) {\n        this.name = name;\n        this.age = age;\n    }\n    \n    public static ImmutableUser of(String name, int age) {\n        return new ImmutableUser(name, age);\n    }\n}",
      "language": "java"
    },
    {
      "type": "interviewAnswer",
      "title": "面试回答模板",
      "content": "建造者模式用于构建复杂对象，它将构建过程与表示分离。主要解决构造函数参数过多、参数顺序混乱的问题。\n\n建造者模式通过链式调用提高代码可读性，比如`new User.Builder().name(\"张三\").age(25).build()`。每个构建步骤返回Builder对象，支持流式调用。\n\nJava中有很多建造者模式的应用：StringBuilder用于构建字符串，Stream.Builder用于构建流，Lombok的@Builder注解可以自动生成建造者代码。\n\n建造者模式与工厂模式的区别是：工厂模式关注创建单个对象，建造者模式关注分步构建复杂对象。建造者模式适合创建具有多个可选参数的对象，特别是当参数之间有依赖关系时。",
      "followUpQuestions": [
        {
          "question": "在Spring框架中，建造者模式有哪些经典应用？能结合源码说说吗？",
          "answer": "建造者模式核心：分步骤构建复杂对象，相同的构建过程可以创建不同的表示。Java中的应用：StringBuilder、Lombok @Builder、Stream.Builder。和工厂模式区别：工厂创建完整对象，建造者分步骤构建复杂对象。"
        },
        {
          "question": "建造者模式 在 Spring/JDK 源码中有哪些经典应用？",
          "answer": "建造者模式 在主流框架中有广泛应用：Spring 的 Bean 工厂用了工厂模式，AOP 用了代理模式，事件机制用了观察者模式；JDK 的 InputStream 用了装饰器模式，Executor 用了策略模式，ThreadPool 用了模板方法模式。理解这些应用有助于在自己的项目中正确使用。"
        },
        {
          "question": "如果在项目中误用了 建造者模式，会导致什么问题？正确的使用时机是什么？",
          "answer": "误用 建造者模式 的常见问题：过度设计导致代码复杂度增加、抽象层次不当导致扩展困难、忽略了模式的适用条件。正确的使用时机是：当你发现代码有明确的变化维度、需要解耦的职责、重复的结构时，才考虑引入设计模式。"
        }
      ]
    },
    {
      "type": "compareTable",
      "title": "对比与边界",
      "content": "| 维度 | 建造者模式 | 工厂模式 | 构造函数 |\n| ------ | ------------ | ---------- | ---------- |\n| 对象复杂度 | 复杂对象 | 简单对象 | 任意对象 |\n| 参数数量 | 多个可选参数 | 少量参数 | 参数固定 |\n| 构建过程 | 分步构建 | 一次性创建 | 一次性创建 |\n| 链式调用 | 支持 | 不支持 | 不支持 |\n| 不可变对象 | 容易实现 | 困难 | 困难 |\n| 代码可读性 | 高 | 中 | 低（参数多时） |\n| 典型应用 | StringBuilder | BeanFactory | 普通对象创建 |"
    },
    {
      "type": "diagram",
      "title": "结构图解",
      "content": "建造者模式通过链式调用逐步构建复杂对象。",
      "fallback": "建造者模式类图：Product类，Builder接口，ConcreteBuilder实现，Director类",
      "items": [
        "1. 定义产品类（多个属性）",
        "2. 创建Builder内部类",
        "3. 每个setter方法返回this",
        "4. build()方法创建产品",
        "5. 链式调用提高可读性"
      ]
    },
    {
      "type": "checklist",
      "title": "学完后应能说清楚",
      "items": [
        "建造者模式的结构和核心要素",
        "如何实现链式调用",
        "与工厂模式的核心区别",
        "Lombok @Builder的工作原理",
        "建造者模式的适用场景"
      ]
    }
  ],
  "recallPrompts": [
    {
      "id": "design-pattern.creational.topic-jian-zao-zhe-mo-shi.recall.1",
      "prompt": "面试官问你：Lombok的@Builder注解是如何工作的？它生成了哪些代码？",
      "mode": "text",
      "expectedMinutes": 3,
      "difficulty": 2
    },
    {
      "id": "design-pattern.creational.topic-jian-zao-zhe-mo-shi.recall.2",
      "prompt": "假设你需要设计一个HTTP请求构建器，支持设置URL、方法、请求头、请求体等参数，你会如何设计？",
      "mode": "text",
      "expectedMinutes": 3,
      "difficulty": 2
    }
  ],
  "rubric": {
    "mustHave": [
      "建造者模式结构",
      "链式调用实现",
      "与工厂模式区别",
      "Lombok@Builder原理",
      "适用场景"
    ],
    "goodToHave": [
      "建造者模式与不可变对象的关系",
      "建造者模式在框架源码中的应用"
    ],
    "commonMistakes": [
      "只记住了类图，不理解设计动机",
      "不能结合Spring源码说明应用场景",
      "不知道何时应该使用设计模式（避免过度设计）"
    ],
    "scoreWeights": {
      "coverage": 35,
      "accuracy": 30,
      "interviewExpression": 20,
      "depth": 15
    }
  },
  "prerequisites": [
    "design-pattern.creational.topic-gong-chang-mo-shi"
  ],
  "interviewFrequency": "medium",
  "interviewerFocus": "考察对设计模式的理解是否停留在类图层面，能否结合Spring等框架说明实际应用"
}
