{
  "id": "dotnet.csharp.type-system",
  "domain": "dotnet",
  "category": "csharp",
  "group": "csharp",
  "title": "C# 类型系统",
  "summary": "深入理解值类型与引用类型的区别、装箱拆箱机制以及可空类型的应用",
  "tags": [
    ".NET",
    "C#",
    "类型系统",
    "值类型",
    "引用类型"
  ],
  "difficulty": 2,
  "estimatedMinutes": 15,
  "order": 10,
  "recommendWeight": 85,
  "status": "draft",
  "learningCards": [
    {
      "type": "explain",
      "title": "核心概念",
      "content": "C# 类型系统是 .NET 开发的基础，理解类型系统对于写出高效、安全的代码至关重要。\n\n\n## 值类型 vs 引用类型\n\n**值类型**直接存储数据，包括：\n- 基本类型：`int`, `float`, `double`, `bool`, `char`\n- 结构体：`struct` 定义的类型\n- 枚举：`enum`\n- 可空值类型：`Nullable<T>` 或 `T?`\n\n值类型存储在**栈**上（局部变量），生命周期随方法结束自动释放，无需垃圾回收。\n\n**引用类型**存储数据的引用（内存地址），包括：\n- 类：`class` 定义的类型\n- 接口：`interface`\n- 委托：`delegate`\n- 数组：`Array`\n- 字符串：`string`\n\n引用类型的实例存储在**堆**上，变量本身只保存指向堆的引用。需要垃圾回收器（GC）管理内存。"
    },
    {
      "type": "explain",
      "title": "深入理解",
      "content": "## 装箱与拆箱\n\n**装箱（Boxing）**：将值类型转换为引用类型\n```csharp\nint num = 42;\nobject obj = num; // 装箱：在堆上创建副本\n```\n\n**拆箱（Unboxing）**：将引用类型转换回值类型\n```csharp\nobject obj = 42;\nint num = (int)obj; // 拆箱：从堆复制到栈\n```\n\n装箱拆箱的性能开销：\n1. 装箱需要分配堆内存\n2. 拆箱需要类型检查和内存复制\n3. 频繁装箱拆箱会影响性能\n\n\n## 可空类型\n\n值类型默认不可为 null，但实际业务中经常需要表示\"无值\"状态：\n```csharp\nint? age = null; // 可空值类型\nif (age.HasValue)\n{\n    Console.WriteLine(age.Value);\n}\n```\n\nC# 8.0 引入**可空引用类型**：\n```csharp\n#nullable enable\nstring? name = null; // 可空引用类型\nstring title = null; // 编译警告\n```\n\n\n## 类型转换\n\n1. **隐式转换**：安全的自动转换，如 `int` → `long`\n2. **显式转换**：需要强制转换，如 `double` → `int`（可能丢失精度）\n3. **Convert 类**：提供类型间的转换方法\n4. **as/is 运算符**：安全的引用类型转换和检查\n\n\n## 实际应用建议\n\n- 优先使用值类型存储小数据（< 16 字节）\n- 避免不必要的装箱拆箱\n- 合理使用可空类型表达业务语义\n- 使用泛型集合替代非泛型集合减少装箱"
    },
    {
      "type": "code",
      "title": "代码示例",
      "content": "using System;\nusing System.Collections.Generic;\n\nnamespace TypeSystemDemo\n{\n    // 值类型示例：结构体\n    public struct Point\n    {\n        public double X { get; set; }\n        public double Y { get; set; }\n\n        public Point(double x, double y)\n        {\n            X = x;\n            Y = y;\n        }\n\n        public override string ToString() => $\"({X}, {Y})\";\n    }\n\n    // 引用类型示例：类\n    public class Person\n    {\n        public string Name { get; set; }\n        public int Age { get; set; }\n\n        public Person(string name, int age)\n        {\n            Name = name;\n            Age = age;\n        }\n    }\n\n    class Program\n    {\n        static void Main()\n        {\n            // 值类型赋值是复制\n            Point p1 = new Point(1, 2);\n            Point p2 = p1; // 复制值\n            p2.X = 10;\n            Console.WriteLine($\"p1: {p1}\"); // (1, 2) - 不受影响\n            Console.WriteLine($\"p2: {p2}\"); // (10, 2)\n\n            // 引用类型赋值是共享引用\n            Person person1 = new Person(\"Alice\", 25);\n            Person person2 = person1; // 共享引用\n            person2.Name = \"Bob\";\n            Console.WriteLine($\"person1.Name: {person1.Name}\"); // Bob - 受影响\n\n            // 装箱拆箱示例\n            int number = 42;\n            object boxed = number; // 装箱\n            int unboxed = (int)boxed; // 拆箱\n\n            // 可空类型\n            int? nullableInt = null;\n            Console.WriteLine(nullableInt.HasValue); // false\n            \n            nullableInt = 100;\n            Console.WriteLine(nullableInt.Value); // 100\n\n            // 空合并运算符\n            int result = nullableInt ?? 0;\n            Console.WriteLine(result); // 100\n\n            // 泛型集合避免装箱\n            List<int> numbers = new List<int> { 1, 2, 3 }; // 无装箱\n            // ArrayList arrayList = new ArrayList { 1, 2, 3 }; // 有装箱\n        }\n    }\n}",
      "language": "csharp"
    },
    {
      "type": "interviewAnswer",
      "title": "面试回答模板",
      "content": "关于 C# 类型系统，我来详细说明一下。\n\n首先，C# 的类型分为值类型和引用类型两大类。值类型包括基本数据类型如 int、float、bool，以及 struct 和 enum，它们直接存储数据，通常分配在栈上，生命周期由作用域决定，不需要垃圾回收。引用类型包括 class、interface、delegate、array 和 string，它们存储的是指向堆内存的引用，需要 GC 管理内存。\n\n两者的核心区别在于：值类型赋值是复制整个数据，而引用类型赋值只是复制引用，两个变量指向同一个对象。这也是为什么修改 person2.Name 会影响 person1.Name 的原因。\n\n关于装箱拆箱，装箱是将值类型隐式转换为 object 类型，会在堆上分配内存并复制数据；拆箱是将 object 显式转换回值类型，需要类型检查和内存复制。这个过程有性能开销，应该尽量避免，比如使用泛型集合 List<int> 而不是 ArrayList。\n\n可空类型是 C# 2.0 引入的重要特性，通过 Nullable<T> 或 T? 语法让值类型也能表示 null。C# 8.0 进一步引入了可空引用类型，通过 #nullable enable 指令启用，编译器会检查可能的 null 引用异常，提高代码安全性。\n\n在实际开发中，我会根据数据特性选择类型：小数据结构用 struct，需要继承或多态用 class，合理使用可空类型表达业务语义，优先使用泛型集合避免装箱。",
      "followUpQuestions": [
        {
          "question": "在 .NET 8/9/10 中，C# 类型系统的实现和Java有什么异同？",
          "answer": "C# 类型系统的核心是理解 .NET 8/9/10 的运行时机制和框架设计。建议对比Java/Spring的实现来加深理解。"
        },
        {
          "question": "C# 类型系统 在 .NET 8/9/10 的演进中有什么变化？跨平台部署时需要注意什么？",
          "answer": ".NET 版本演进带来了显著改进：.NET 8 是 LTS，强化 Native AOT、性能和云原生；.NET 9 是 STS，继续改进运行时、C# 和 ASP.NET Core；.NET 10 是 LTS，带来 JIT/NativeAOT、库、SDK、ASP.NET Core、Blazor、OpenAPI 和诊断能力升级。跨平台部署需要注意 Windows 特有 API 的替代、文件路径差异、时区处理、原生依赖、容器镜像和目标运行时支持周期。"
        },
        {
          "question": "如果 C# 类型系统 在 .NET 应用中出现了性能问题或内存泄漏，你会怎么排查？",
          "answer": "排查 .NET 性能问题的思路：用 dotnet-trace 收集运行时跟踪数据，用 dotnet-dump 分析内存转储，用 BenchmarkDotNet 做微基准测试。常见问题包括大对象堆碎片、Finalizer 队列积压、线程池饥饿、GC 暂停过长等。PerfView 和 Visual Studio Diagnostic Tools 也很有用。"
        }
      ]
    },
    {
      "type": "compareTable",
      "title": "对比与边界",
      "content": "| 维度 | 值类型 | 引用类型 |\n| --- | --- | --- |\n| 存储位置 | 栈（局部变量）/ 堆（字段、数组元素） | 堆 |\n| 内存分配 | 编译时确定大小 | 运行时动态分配 |\n| 赋值行为 | 复制整个值 | 复制引用 |\n| 默认值 | 0/false/结构体默认值 | null |\n| 垃圾回收 | 不需要 | 需要 GC 回收 |\n| 继承 | 不能继承，可实现接口 | 支持继承 |\n| 装箱拆箱 | 可装箱为 object | 不需要 |\n| null 值 | 默认不可为 null（需 T?） | 可以为 null |\n| 性能 | 无堆分配开销 | 有堆分配和 GC 开销 |\n| 典型应用 | 小数据结构、频繁创建销毁 | 复杂对象、需要共享引用 |"
    },
    {
      "type": "diagram",
      "title": "结构图解",
      "content": "C# 类型系统内存模型：\n\n栈内存（Stack）：\n┌─────────────────┐\n│ int x = 10      │ ← 值类型变量\n│ Point p = (1,2) │ ← 结构体变量\n│ object obj      │ ← 引用变量（存地址）\n└─────────────────┘\n          ↓ 引用\n堆内存（Heap）：\n┌─────────────────┐\n│ Person {Name:\"Alice\", Age:25} │ ← 引用类型实例\n│ int[] arr = [1,2,3]           │ ← 数组实例\n└─────────────────┘\n\n装箱过程：\n栈: int 42 → object引用 → 堆: object{int 42}",
      "fallback": "栈存储值类型和引用变量，堆存储引用类型实例",
      "items": [
        "值类型直接存储数据在栈上",
        "引用类型存储引用在栈，实例在堆",
        "装箱将值类型复制到堆",
        "拆箱将堆数据复制回栈"
      ]
    },
    {
      "type": "checklist",
      "title": "学完后应能说清楚",
      "items": [
        "值类型和引用类型的区别及各自的存储位置",
        "装箱拆箱的过程和性能影响",
        "可空值类型和可空引用类型的使用场景",
        "何时选择 struct 而非 class",
        "如何避免不必要的装箱拆箱",
        "类型转换的各种方式及适用场景"
      ]
    }
  ],
  "recallPrompts": [
    {
      "id": "dotnet.csharp.type-system.recall.1",
      "prompt": "请说明 C# 类型系统 的核心机制、典型使用场景和常见坑。",
      "mode": "text",
      "expectedMinutes": 3,
      "difficulty": 2
    },
    {
      "id": "dotnet.csharp.type-system.recall.2",
      "prompt": "什么是装箱和拆箱？请举例说明，并解释如何在实际开发中避免不必要的装箱操作。",
      "mode": "text",
      "expectedMinutes": 3,
      "difficulty": 3
    }
  ],
  "rubric": {
    "mustHave": [
      "清楚区分值类型和引用类型的定义和特点",
      "理解栈和堆的存储机制",
      "掌握装箱拆箱的概念和性能影响",
      "了解可空类型的使用方法",
      "知道何时选择值类型或引用类型"
    ],
    "goodToHave": [
      "了解 Nullable<T> 的内部实现",
      "理解泛型如何避免装箱",
      "知道 readonly struct 的优势"
    ],
    "commonMistakes": [
      "对 .NET 8/9/10 的运行时机制理解不深入",
      "不清楚和Java/Spring的异同",
      "不能结合实际项目说明应用场景"
    ],
    "scoreWeights": {
      "coverage": 35,
      "accuracy": 30,
      "interviewExpression": 20,
      "depth": 15
    }
  },
  "interviewFrequency": "high",
  "interviewerFocus": "考察.NET技术栈的深度，是否理解运行时机制和框架设计，能否和Java生态做对比"
}
