{
  "id": "frontend.nodejs.topic-node-modules",
  "domain": "frontend",
  "category": "nodejs",
  "group": "nodejs",
  "title": "Node.js模块系统与包管理",
  "summary": "掌握CommonJS和ESM两种模块系统的区别和使用，了解npm/yarn/pnpm的差异，理解monorepo的管理方式。",
  "tags": [
    "前端",
    "Node.js",
    "模块系统",
    "npm",
    "pnpm",
    "monorepo"
  ],
  "difficulty": 2,
  "estimatedMinutes": 10,
  "order": 20,
  "recommendWeight": 74,
  "status": "draft",
  "learningCards": [
    {
      "type": "explain",
      "title": "知识全景",
      "content": "## 模块系统\n\n### CommonJS (CJS)\n- `require()`导入，`module.exports`导出\n- 同步加载，运行时确定依赖\n- Node.js原生支持\n\n### ES Modules (ESM)\n- `import/export`语法\n- 静态分析，编译时确定依赖\n- 支持Tree Shaking\n- 需要.mjs扩展名或package.json中type:module\n\n### 包管理器对比\n**npm**：Node.js默认，v7+支持workspace\n**yarn**：速度快，yarn berry(pnP)无node_modules\n**pnpm**：硬链接+符号链接，节省磁盘空间，严格依赖隔离\n\n### monorepo\n- 单仓多包，代码共享方便\n- pnpm workspace / yarn workspace / nx / turborepo\n- 统一版本管理、依赖管理"
    },
    {
      "type": "code",
      "title": "代码示例",
      "content": "// CommonJS\n// math.js\nconst add = (a, b) => a + b;\nmodule.exports = { add };\n\n// app.js\nconst { add } = require('./math');\nconsole.log(add(1, 2));\n\n// ES Modules\n// math.mjs\nexport const add = (a, b) => a + b;\nexport default function multiply(a, b) { return a * b; }\n\n// app.mjs\nimport multiply, { add } from './math.mjs';\nconsole.log(add(1, 2));\n\n// CJS和ESM互操作\n// 在CJS中使用ESM（Node 14+）\nasync function main() {\n  const { add } = await import('./math.mjs'); // 动态import\n}\n\n// package.json配置\n// {\n//   \"type\": \"module\",  // 全局ESM\n//   \"exports\": {\n//     \".\": {\n//       \"import\": \"./dist/index.mjs\",\n//       \"require\": \"./dist/index.cjs\"\n//     }\n//   }\n// }\n\n// pnpm workspace配置\n// pnpm-workspace.yaml\n// packages:\n//   - 'packages/*'\n//   - 'apps/*'\n\n// package.json\n// {\n//   \"name\": \"my-monorepo\",\n//   \"private\": true,\n//   \"workspaces\": [\"packages/*\", \"apps/*\"]\n// }\n\n// pnpm常用命令\n// pnpm add <pkg> -w          安装到根目录\n// pnpm add <pkg> --filter @my/lib  安装到指定包\n// pnpm -r run build          递归执行build\n// pnpm --filter @my/app dev  运行指定包的dev\n\n// 依赖管理对比\n// npm install          → node_modules扁平结构（幽灵依赖）\n// yarn install         → node_modules扁平结构（幽灵依赖）\n// pnpm install         → .pnpm硬链接+符号链接（严格隔离）\n\n// exports字段的条件导出\n// {\n//   \"exports\": {\n//     \".\": {\n//       \"types\": \"./dist/index.d.ts\",\n//       \"import\": \"./dist/index.mjs\",\n//       \"require\": \"./dist/index.cjs\",\n//       \"default\": \"./dist/index.js\"\n//     }\n//   }\n// }",
      "language": "javascript"
    },
    {
      "type": "interviewAnswer",
      "title": "面试回答模板",
      "content": "Node.js有两套模块系统：CommonJS使用require同步加载，运行时确定依赖；ESM使用import/export静态语法，编译时确定依赖，支持Tree Shaking。两者不能直接混用，需要通过动态import()桥接。\n\n包管理器方面，npm是默认选择，yarn引入了lockfile和并行安装，pnpm通过硬链接+符号链接解决了node_modules的磁盘空间问题和幽灵依赖问题。pnpm的严格依赖隔离让包只能访问自己声明的依赖。\n\nmonorepo是单仓多包的项目组织方式，适合多个关联包的项目。pnpm workspace是最轻量的方案，配合changesets管理版本发布。大型项目可以用nx或turborepo，它们提供任务编排和缓存能力。",
      "followUpQuestions": [
        {
          "question": "在实际前端项目中，Node.js模块系统与包管理的最佳实践是什么？有哪些常见的坑？",
          "answer": "Node.js模块系统与包管理的核心是理解浏览器/Node.js的运行机制。建议通过Chrome DevTools的Performance面板和Sources面板实际调试。"
        },
        {
          "question": "Node.js模块系统与包管理 的核心原理是什么？和其他方案相比有什么优劣？",
          "answer": "Node.js模块系统与包管理 的核心原理涉及浏览器渲染引擎、JavaScript 运行时、网络协议等底层知识。理解原理有助于在不同方案间做出合理选择，也能在遇到问题时快速定位根因。"
        },
        {
          "question": "如果 Node.js模块系统与包管理 在生产环境出了性能或兼容性问题，你会怎么排查？",
          "answer": "排查 Node.js模块系统与包管理 问题的思路：先看浏览器兼容性数据和用户环境分布，再用 DevTools 的 Network/Performance/Console 面板定位。对于跨平台问题，需要在不同设备和浏览器上复现。监控平台的错误日志和性能数据是重要的线索。"
        }
      ]
    },
    {
      "type": "compareTable",
      "title": "对比与边界",
      "content": "| 维度 | CommonJS | ES Modules |\n| --- | --- | --- |\n| 语法 | require/module.exports | import/export |\n| 加载方式 | 同步 | 异步 |\n| 确定时机 | 运行时 | 编译时（静态分析） |\n| Tree Shaking | 不支持 | 支持 |\n| this指向 | module.exports | undefined |\n| 顶层await | 不支持 | 支持 |\n| 使用场景 | Node.js服务端 | 前端+现代Node.js |\n| 文件扩展名 | .js/.cjs | .js/.mjs |"
    },
    {
      "type": "diagram",
      "title": "结构图解",
      "content": "包管理器依赖结构：npm/yarn使用扁平化node_modules（有幽灵依赖问题），pnpm使用.pnpm硬链接+符号链接（严格隔离，节省空间）。",
      "fallback": "npm/yarn: node_modules/pkg-a, node_modules/pkg-b（扁平，幽灵依赖）；pnpm: .pnpm/硬链接 → node_modules/符号链接（严格隔离）",
      "items": [
        "npm/yarn扁平化导致幽灵依赖",
        "pnpm硬链接节省磁盘空间",
        "pnpm符号链接实现严格隔离",
        "monorepo统一管理多个关联包",
        "exports字段支持条件导出"
      ]
    },
    {
      "type": "checklist",
      "title": "学完后应能说清楚",
      "items": [
        "CommonJS和ESM的区别",
        "npm、yarn、pnpm的差异",
        "pnpm如何解决幽灵依赖问题",
        "monorepo的组织方式和工具选择",
        "package.json的exports字段用法"
      ]
    }
  ],
  "recallPrompts": [
    {
      "id": "frontend.nodejs.topic-node-modules.recall.1",
      "prompt": "CommonJS和ESM有什么区别？为什么ESM支持Tree Shaking？",
      "mode": "text",
      "expectedMinutes": 3,
      "difficulty": 2
    },
    {
      "id": "frontend.nodejs.topic-node-modules.recall.2",
      "prompt": "pnpm相比npm/yarn有什么优势？什么是幽灵依赖？",
      "mode": "text",
      "expectedMinutes": 3,
      "difficulty": 2
    }
  ],
  "rubric": {
    "mustHave": [
      "能区分CJS和ESM的语法和加载方式",
      "能说出npm/yarn/pnpm的核心差异",
      "能解释pnpm的硬链接机制",
      "能说出monorepo的概念和工具",
      "能解释exports字段的作用"
    ],
    "goodToHave": [
      "能解释幽灵依赖问题",
      "能解释pnp模式",
      "能配置pnpm workspace"
    ],
    "commonMistakes": [
      "对浏览器/Node.js运行机制理解不深入",
      "不能手写核心实现",
      "不知道如何排查前端性能问题"
    ],
    "scoreWeights": {
      "coverage": 35,
      "accuracy": 30,
      "interviewExpression": 20,
      "depth": 15
    }
  },
  "prerequisites": [
    "frontend.nodejs.topic-node-core"
  ],
  "interviewFrequency": "medium",
  "interviewerFocus": "考察前端基础功底，是否理解浏览器/JS引擎的工作机制，能否手写核心实现"
}
