{
  "id": "frontend.engineering.topic-cicd-deploy",
  "domain": "frontend",
  "category": "engineering",
  "group": "engineering",
  "title": "前端CI/CD与发布",
  "summary": "掌握Git工作流、CI/CD流水线配置、灰度发布策略、CDN部署和语义化版本管理。",
  "tags": [
    "前端",
    "工程化",
    "CI/CD",
    "Git",
    "灰度发布",
    "CDN"
  ],
  "difficulty": 3,
  "estimatedMinutes": 10,
  "order": 30,
  "recommendWeight": 65,
  "status": "production",
  "learningCards": [
    {
      "type": "explain",
      "title": "知识全景",
      "content": "## Git工作流\n- **Git Flow**：feature/develop/release/main/hotfix\n- **Trunk Based**：主干开发，短命分支\n- **GitHub Flow**：main + feature分支 + PR\n\n## CI/CD流水线\n- **CI（持续集成）**：代码提交后自动构建、测试、Lint\n- **CD（持续部署）**：自动部署到测试/生产环境\n- 工具：GitHub Actions、GitLab CI、Jenkins\n\n## 灰度发布\n- 按比例逐步放量\n- 按用户特征定向发布\n- 快速回滚能力\n\n## CDN\n- 静态资源上CDN\n- 配置缓存策略（强缓存+协商缓存）\n- HTML不缓存，JS/CSS长期缓存\n\n## 语义化版本（semver）\n- MAJOR.MINOR.PATCH\n- MAJOR：不兼容的API变更\n- MINOR：向下兼容的新功能\n- PATCH：向下兼容的Bug修复"
    },
    {
      "type": "code",
      "title": "代码示例",
      "content": "# GitHub Actions CI/CD\n# .github/workflows/ci.yml\nname: CI\non:\n  push:\n    branches: [main]\n  pull_request:\n    branches: [main]\n\njobs:\n  build:\n    runs-on: ubuntu-latest\n    steps:\n      - uses: actions/checkout@v4\n      - uses: actions/setup-node@v4\n        with:\n          node-version: 20\n          cache: 'pnpm'\n      - run: pnpm install --frozen-lockfile\n      - run: pnpm lint        # ESLint检查\n      - run: pnpm test         # 单元测试\n      - run: pnpm build        # 构建\n      - uses: actions/upload-artifact@v4\n        with:\n          name: dist\n          path: dist/\n\n  deploy:\n    needs: build\n    if: github.ref == 'refs/heads/main'\n    runs-on: ubuntu-latest\n    steps:\n      - uses: actions/download-artifact@v4\n        with:\n          name: dist\n      - run: npx netlify deploy --prod --dir=dist\n\n# nginx配置（SPA部署）\nserver {\n  listen 80;\n  server_name example.com;\n\n  # HTML不缓存\n  location / {\n    root /usr/share/nginx/html;\n    try_files $uri $uri/ /index.html; # SPA路由\n    add_header Cache-Control no-cache;\n  }\n\n  # 静态资源长期缓存\n  location /assets/ {\n    root /usr/share/nginx/html;\n    expires 1y;\n    add_header Cache-Control \"public, immutable\";\n  }\n}\n\n# Dockerfile\nFROM node:20-alpine AS builder\nWORKDIR /app\nCOPY package*.json ./\nRUN npm ci\nCOPY . .\nRUN npm run build\n\nFROM nginx:alpine\nCOPY --from=builder /app/dist /usr/share/nginx/html\nCOPY nginx.conf /etc/nginx/conf.d/default.conf\nEXPOSE 80\n\n# semver示例\n# 1.0.0 → 1.0.1 (patch: bug修复)\n# 1.0.0 → 1.1.0 (minor: 新功能)\n# 1.0.0 → 2.0.0 (major: 不兼容变更)\n# 0.x.x: 开发阶段，API不稳定",
      "language": "javascript"
    },
    {
      "type": "interviewAnswer",
      "title": "面试回答模板",
      "content": "CI/CD流水线是现代前端工程的标准配置。CI（持续集成）在代码提交后自动运行Lint、测试、构建，保证代码质量。CD（持续部署）在CI通过后自动部署到测试或生产环境。GitHub Actions是最常用的CI/CD工具。\n\n灰度发布是降低上线风险的策略。先发布给小部分用户，观察监控指标正常后再逐步放量。可以按比例放量，也可以按用户ID、地区等特征定向发布。发现问题可以快速回滚。\n\nCDN部署是前端性能优化的关键。静态资源（JS/CSS/图片）上CDN并设置长期缓存（hash文件名+1年过期），HTML文件不缓存或短缓存。这样每次发版更新文件名，浏览器自动获取新资源。",
      "followUpQuestions": [
        {
          "question": "在实际前端项目中，前端CI/CD与发布的最佳实践是什么？有哪些常见的坑？",
          "answer": "前端CI/CD与发布的核心是理解浏览器/Node.js的运行机制。建议通过Chrome DevTools的Performance面板和Sources面板实际调试。"
        },
        {
          "question": "如果面试官让你对比前端CI/CD与发布中提到的几种方案，你会怎么分析各自的优劣？",
          "answer": "对比前端CI/CD与发布中的方案时，我通常从这几个维度分析：维度、分支策略、适用场景、复杂度。关键不是哪个绝对更好，而是理解各自的适用边界。面试时先说结论，再展开分析各维度差异，最后结合场景给出理由。"
        },
        {
          "question": "在实际项目中使用前端CI/CD与发布时，你遇到过什么问题？是怎么发现和解决的？",
          "answer": "前端最常见坑：1）闭包导致内存泄漏；2）this指向问题；3）异步竞态条件（组件卸载后setState）；4）虚拟DOM的key用index。"
        }
      ]
    },
    {
      "type": "compareTable",
      "title": "对比与边界",
      "content": "| 维度 | Git Flow | Trunk Based | GitHub Flow |\n| --- | --- | --- | --- |\n| 分支策略 | 多分支（develop/release） | 主干+短命分支 | main+feature |\n| 适用场景 | 版本发布周期长 | 持续部署 | 开源项目 |\n| 复杂度 | 高 | 低 | 低 |\n| 部署频率 | 低 | 高 | 中 |\n| 回滚难度 | 中 | 低 | 低 |\n| 团队规模 | 大团队 | 小中团队 | 小团队 |"
    },
    {
      "type": "diagram",
      "title": "结构图解",
      "content": "CI/CD流水线：代码push → CI触发 → Lint+Test+Build → CD触发 → 部署到测试环境 → 人工验证 → 灰度发布到生产 → 全量发布。",
      "fallback": "push→CI(Lint→Test→Build)→CD(测试环境)→验证→灰度(1%→10%→100%)→生产",
      "items": [
        "代码push触发CI流水线",
        "CI执行Lint/Test/Build",
        "CD自动部署到测试环境",
        "灰度发布逐步放量",
        "监控异常快速回滚"
      ]
    },
    {
      "type": "checklist",
      "title": "学完后应能说清楚",
      "items": [
        "Git工作流的选择和适用场景",
        "CI/CD流水线的配置和步骤",
        "灰度发布的策略和实施",
        "CDN缓存策略的配置",
        "语义化版本的规则"
      ]
    }
  ],
  "recallPrompts": [
    {
      "id": "frontend.engineering.topic-cicd-deploy.recall.1",
      "prompt": "如何配置前端项目的CI/CD流水线？需要哪些步骤？",
      "mode": "text",
      "expectedMinutes": 3,
      "difficulty": 2
    },
    {
      "id": "frontend.engineering.topic-cicd-deploy.recall.2",
      "prompt": "前端静态资源的CDN缓存策略应该如何配置？",
      "mode": "text",
      "expectedMinutes": 3,
      "difficulty": 2
    }
  ],
  "rubric": {
    "mustHave": [
      "能说出CI/CD的概念和区别",
      "能配置基本的GitHub Actions流水线",
      "能解释灰度发布的策略",
      "能说出CDN缓存策略的配置",
      "能解释语义化版本的规则"
    ],
    "goodToHave": [
      "能解释不同Git工作流的适用场景",
      "能配置Docker容器化部署",
      "能解释nginx的SPA路由配置"
    ],
    "commonMistakes": [
      "对浏览器/Node.js运行机制理解不深入",
      "不能手写核心实现",
      "不知道如何排查前端性能问题"
    ],
    "scoreWeights": {
      "coverage": 35,
      "accuracy": 30,
      "interviewExpression": 20,
      "depth": 15
    }
  },
  "prerequisites": [
    "frontend.engineering.topic-vite-principle"
  ],
  "interviewFrequency": "low",
  "interviewerFocus": "考察前端基础功底，是否理解浏览器/JS引擎的工作机制，能否手写核心实现"
}