{
  "id": "frontend.typescript.topic-ts-type-gymnastics",
  "domain": "frontend",
  "category": "typescript",
  "group": "typescript",
  "title": "类型体操实战",
  "summary": "掌握TypeScript映射类型、模板字面量类型和递归类型的高级用法，能够解决复杂的类型编程问题。",
  "tags": [
    "前端",
    "TypeScript",
    "类型体操",
    "映射类型"
  ],
  "difficulty": 4,
  "estimatedMinutes": 25,
  "order": 30,
  "recommendWeight": 75,
  "status": "draft",
  "learningCards": [
    {
      "type": "explain",
      "title": "核心概念",
      "content": "## 类型体操核心技巧\n\n\n### 映射类型（Mapped Types）\n```ts\n// 遍历联合类型的每个成员\ntype Keys = 'a' | 'b' | 'c';\ntype Obj = { [K in Keys]: string }; // { a: string; b: string; c: string }\n\n// 结合 keyof 遍历对象属性\ntype Readonly<T> = { readonly [K in keyof T]: T[K]; };\n```"
    },
    {
      "type": "explain",
      "title": "深入理解",
      "content": "### 模板字面量类型（Template Literal Types）\n```ts\ntype Greeting = `hello ${string}`;\ntype EventName = `on${Capitalize<'click' | 'change'>}`; // 'onClick' | 'onChange'\n\n// 组合生成\ntype Color = 'red' | 'blue';\ntype Size = 'sm' | 'lg';\ntype ClassName = `${Color}-${Size}`; // 'red-sm' | 'red-lg' | 'blue-sm' | 'blue-lg'\n```\n\n\n### 递归类型\n```ts\n// 深度只读\ntype DeepReadonly<T> = {\n    readonly [K in keyof T]: T[K] extends object ? DeepReadonly<T[K]> : T[K];\n};\n\n// 元组转联合\ntype TupleToUnion<T extends any[]> = T[number];\ntype U = TupleToUnion<[1, 2, 3]>; // 1 | 2 | 3\n```\n\n\n### 常用类型体操题\n- DeepPartial：深层可选\n- DeepReadonly：深层只读\n- Flatten：数组展平\n- LengthOfString：字符串长度\n- ParseInt：字符串转数字"
    },
    {
      "type": "code",
      "title": "代码示例",
      "content": "// DeepPartial\nexport type DeepPartial<T> = T extends object\n  ? { [K in keyof T]?: DeepPartial<T[K]> }\n  : T;\n\n// DeepReadonly\ntype DeepReadonly<T> = {\n  readonly [K in keyof T]: T[K] extends object ? DeepReadonly<T[K]> : T[K];\n};\n\n// 元组操作\ntype Head<T extends any[]> = T extends [infer H, ...any[]] ? H : never;\ntype Tail<T extends any[]> = T extends [any, ...infer R] ? R : never;\ntype Last<T extends any[]> = T extends [...any[], infer L] ? L : never;\n\n// 字符串操作\ntype Capitalize<S extends string> = S extends `${infer H}${infer T}`\n  ? `${Uppercase<H>}${T}`\n  : S;\n\n// 字符串转联合类型\ntype StringToUnion<S extends string> = S extends `${infer H}${infer T}`\n  ? H | StringToUnion<T>\n  : never;\ntype SU = StringToUnion<'hello'>; // 'h' | 'e' | 'l' | 'l' | 'o'\n\n// 数字类型运算（通过元组长度）\ntype BuildTuple<N extends number, T extends any[] = []>\n  = T['length'] extends N ? T : BuildTuple<N, [...T, any]>;\n\n// 加法\ntype Add<A extends number, B extends number> =\n  [...BuildTuple<A>, ...BuildTuple<B>]['length'] & number;\ntype Sum = Add<2, 3>; // 5\n\n// Chainable Options（链式API类型）\ntype Chainable<T = {}> = {\n  option<K extends string, V>(\n    key: K extends keyof T ? never : K,\n    value: V\n  ): Chainable<T & Record<K, V>>;\n  get(): T;\n};\n\n// 使用\nconst result = {}\n  .option('name', 'hello')\n  .option('age', 42)\n  .get();\n// type: { name: string; age: number }",
      "language": "typescript"
    },
    {
      "type": "interviewAnswer",
      "title": "面试回答模板",
      "content": "类型体操是TypeScript类型编程的高级技巧，核心有三个：映射类型、模板字面量类型和递归类型。\n\n映射类型通过in关键字遍历联合类型或keyof结果，对每个成员应用变换。比如Partial就是映射类型加上可选修饰符。可以结合条件类型做更复杂的变换。\n\n模板字面量类型在TS 4.1引入，允许在类型层面操作字符串。配合内置的Uppercase/Lowercase等工具类型，可以生成复杂的字符串字面量类型。这在事件命名、CSS类名生成等场景很有用。\n\n递归类型通过在条件类型中引用自身实现，用于处理深层嵌套结构。比如DeepPartial、DeepReadonly都是递归映射类型。需要注意递归深度限制。\n\n在面试中，这类题主要考察对TS类型系统的深入理解。解题思路是：先确定输入输出类型，再选择合适的类型工具组合实现。",
      "followUpQuestions": [
        {
          "question": "类型体操实战的类型推导/类型检查机制是怎样的？",
          "answer": "这个问题可以从几个层面来回答。能解释映射类型的语法和原理。能实现DeepPartial递归类型。能使用模板字面量类型生成组合类型。把这些要点串起来，就能给面试官一个有深度的回答。"
        },
        {
          "question": "实际项目中，技巧和语法你会怎么选？能结合具体场景说说吗？",
          "answer": "选型要看具体场景。以技巧为例，技巧：语法 vs 用途；映射类型：`{[K in keyof T]: ...}` vs 批量变换对象属性；条件类型：`T extends U ? X : Y` vs 按条件选择类型。关键不是哪个绝对更好，而是根据业务场景的约束条件做出合理选择，并能说清楚trade-off。"
        },
        {
          "question": "有人说\"递归类型忘记终止条件\"，这种说法对吗？为什么？",
          "answer": "面试官确实喜欢从这个角度追问。常见误区有：递归类型忘记终止条件；忽略分布式条件类型的特殊行为。回答时不要只是说\"这是错的\"，要解释为什么错、正确的做法是什么，最好能结合具体代码或场景。"
        }
      ]
    },
    {
      "type": "compareTable",
      "title": "对比与边界",
      "content": "| 技巧 | 语法 | 用途 | 难度 |\n| --- | --- | --- | --- |\n| 映射类型 | `{[K in keyof T]: ...}` | 批量变换对象属性 | 中 |\n| 条件类型 | `T extends U ? X : Y` | 按条件选择类型 | 中 |\n| infer | `T extends infer R ? R : never` | 捕获类型 | 高 |\n| 模板字面量 | `` `prefix${T}` `` | 字符串类型操作 | 中 |\n| 递归类型 | 条件类型中引用自身 | 深层结构处理 | 高 |\n| 分布式条件 | 联合类型自动分配 | 批量条件处理 | 高 |"
    },
    {
      "type": "diagram",
      "title": "结构图解",
      "content": "类型体操技巧组合：映射类型遍历属性 → 条件类型按条件变换 → infer捕获中间类型 → 模板字面量操作字符串 → 递归处理深层结构。",
      "fallback": "映射类型{[K in keyof T]} → 条件类型extends ? : → infer捕获 → 模板字面量`...` → 递归引用自身",
      "items": [
        "映射类型批量遍历和变换属性",
        "条件类型实现类型分支",
        "infer捕获待推断的类型",
        "模板字面量在类型层面操作字符串",
        "递归类型处理无限深度结构"
      ]
    },
    {
      "type": "checklist",
      "title": "学完后应能说清楚",
      "items": [
        "映射类型的语法和使用场景",
        "模板字面量类型的用法",
        "递归类型的实现方式",
        "DeepPartial和DeepReadonly的实现原理",
        "元组操作的基本技巧（Head/Tail/Last）"
      ]
    }
  ],
  "recallPrompts": [
    {
      "id": "frontend.typescript.topic-ts-type-gymnastics.recall.1",
      "prompt": "用TypeScript实现DeepPartial类型",
      "mode": "text",
      "expectedMinutes": 3,
      "difficulty": 3
    },
    {
      "id": "frontend.typescript.topic-ts-type-gymnastics.recall.2",
      "prompt": "模板字面量类型有什么用？如何生成组合的字符串字面量类型？",
      "mode": "text",
      "expectedMinutes": 3,
      "difficulty": 3
    }
  ],
  "rubric": {
    "mustHave": [
      "能解释映射类型的语法和原理",
      "能实现DeepPartial递归类型",
      "能使用模板字面量类型生成组合类型",
      "能解释infer在类型体操中的作用",
      "能解释分布式条件类型的行为"
    ],
    "goodToHave": [
      "能实现元组操作类型（Head/Tail/Last）",
      "能实现简单的类型级别运算",
      "能解释递归类型的深度限制"
    ],
    "commonMistakes": [
      "递归类型忘记终止条件",
      "忽略分布式条件类型的特殊行为",
      "混淆映射类型中的as子句"
    ],
    "scoreWeights": {
      "coverage": 25,
      "accuracy": 30,
      "interviewExpression": 20,
      "depth": 25
    }
  },
  "prerequisites": [
    "frontend.typescript.topic-ts-generics"
  ]
}
