{
  "id": "frontend.js-fundamentals.topic-607-5ceefc1c",
  "domain": "frontend",
  "category": "js-fundamentals",
  "group": "js-fundamentals",
  "title": "手写Promise",
  "summary": "Promise三种状态及转换规则；构造函数中executor的执行时机；then方法返回新Promise的原因。",
  "tags": [
    "前端",
    "JavaScript",
    "Promise",
    "手写"
  ],
  "difficulty": 4,
  "estimatedMinutes": 10,
  "order": 60,
  "recommendWeight": 95,
  "status": "production",
  "learningCards": [
    {
      "type": "explain",
      "title": "知识全景",
      "content": "# 手写Promise\n\n## 核心要点\nPromise是一个状态机，有三种状态：pending、fulfilled、rejected。状态只能从pending转变，且不可逆。\n\n## 关键实现\n1. 构造函数接收executor，同步执行\n2. then方法返回新Promise（链式调用）\n3. 异步回调存储（pending状态时）\n4. 微任务执行（queueMicrotask）\n\n## 面试高频考点\n- 为什么then返回新Promise？（实现链式调用）\n- 如何处理异步？（回调队列）\n- resolve的值是Promise怎么办？（递归解析）"
    },
    {
      "type": "code",
      "title": "代码示例",
      "content": "class MyPromise {\n    static PENDING = 'pending';\n    static FULFILLED = 'fulfilled';\n    static REJECTED = 'rejected';\n\n    constructor(executor) {\n        this.status = MyPromise.PENDING;\n        this.value = undefined;\n        this.callbacks = [];\n        try {\n            executor(this.resolve.bind(this), this.reject.bind(this));\n        } catch (e) {\n            this.reject(e);\n        }\n    }\n\n    resolve(value) {\n        if (this.status !== MyPromise.PENDING) return;\n        this.status = MyPromise.FULFILLED;\n        this.value = value;\n        this.callbacks.forEach(cb => cb.onFulfilled(value));\n    }\n\n    reject(reason) {\n        if (this.status !== MyPromise.PENDING) return;\n        this.status = MyPromise.REJECTED;\n        this.value = reason;\n        this.callbacks.forEach(cb => cb.onRejected(reason));\n    }\n\n    then(onFulfilled, onRejected) {\n        return new MyPromise((resolve, reject) => {\n            const handle = (fn) => {\n                queueMicrotask(() => {\n                    try {\n                        const result = fn(this.value);\n                        if (result instanceof MyPromise) {\n                            result.then(resolve, reject);\n                        } else {\n                            resolve(result);\n                        }\n                    } catch (e) {\n                        reject(e);\n                    }\n                });\n            };\n            if (this.status === MyPromise.FULFILLED) {\n                handle(onFulfilled);\n            } else if (this.status === MyPromise.REJECTED) {\n                handle(onRejected);\n            } else {\n                this.callbacks.push({ onFulfilled: () => handle(onFulfilled), onRejected: () => handle(onRejected) });\n            }\n        });\n    }\n}",
      "language": "javascript"
    },
    {
      "type": "interviewAnswer",
      "title": "面试回答模板",
      "content": "面试时我会先说Promise的本质是一个状态机，然后从构造函数→resolve/reject→then三个部分讲解。重点强调：1）then返回新Promise实现链式调用；2）用queueMicrotask模拟微任务；3）resolve传入Promise时需要递归解析。最后说手写Promise是检验对异步理解深度的好题目。",
      "followUpQuestions": [
        {
          "question": "在实际前端项目中，手写Promise的最佳实践是什么？有哪些常见的坑？",
          "answer": "手写Promise关键：then方法返回新Promise实现链式调用、异步执行用微任务队列、错误冒泡用try-catch。Promise.all用计数器判断全部完成，Promise.race用第一个resolve/reject。async/await是Promise的语法糖，本质是Generator+自动执行器。"
        },
        {
          "question": "如果面试官让你对比手写Promise中提到的几种方案，你会怎么分析各自的优劣？",
          "answer": "对比手写Promise中的方案时，我通常从这几个维度分析：维度、本质、错误处理、链式调用。关键不是哪个绝对更好，而是理解各自的适用边界。面试时先说结论，再展开分析各维度差异，最后结合场景给出理由。"
        },
        {
          "question": "在实际项目中使用手写Promise时，你遇到过什么问题？是怎么发现和解决的？",
          "answer": "前端最常见坑：1）闭包导致内存泄漏；2）this指向问题；3）异步竞态条件（组件卸载后setState）；4）虚拟DOM的key用index。"
        }
      ]
    },
    {
      "type": "compareTable",
      "title": "对比与边界",
      "content": "| 维度 | 手写Promise | async/await |\n| --- | --- | --- |\n| 本质 | 状态机+回调队列 | Promise的语法糖 |\n| 错误处理 | catch方法 | try/catch |\n| 链式调用 | then返回新Promise | 自动展开 |\n| 调试难度 | 难 | 容易 |\n| 面试频率 | 高 | 低（太简单）|"
    },
    {
      "type": "diagram",
      "title": "结构图解",
      "content": "手写Promise的核心结构",
      "fallback": "手写Promise的关键要点",
      "items": [
        "Promise三种状态及转换规则",
        "构造函数中executor的执行时机",
        "then方法返回新Promise的原因",
        "异步回调的存储和执行机制",
        "微任务执行方式"
      ]
    },
    {
      "type": "checklist",
      "title": "学完后应能说清楚",
      "items": [
        "Promise三种状态及转换规则",
        "构造函数中executor的执行时机",
        "then方法返回新Promise的原因",
        "异步回调的存储和执行机制",
        "微任务执行方式",
        "resolve传入Promise的递归处理",
        "手写代码能跑通基本用例"
      ]
    }
  ],
  "recallPrompts": [
    {
      "id": "frontend.js-fundamentals.topic-607-5ceefc1c.recall.1",
      "prompt": "请解释手写Promise的核心概念和适用场景",
      "mode": "text",
      "expectedMinutes": 3,
      "difficulty": 2
    },
    {
      "id": "frontend.js-fundamentals.topic-607-5ceefc1c.recall.2",
      "prompt": "手写手写Promise的实现代码",
      "mode": "text",
      "expectedMinutes": 3,
      "difficulty": 3
    },
    {
      "id": "frontend.js-fundamentals.topic-607-5ceefc1c.code.1",
      "prompt": "请手写一个通用的类型判断函数 getType(value)",
      "mode": "code",
      "expectedMinutes": 10,
      "difficulty": 2
    },
    {
      "id": "frontend.js-fundamentals.topic-607-5ceefc1c.code.2",
      "prompt": "请手写 Promise.all 的实现",
      "mode": "code",
      "expectedMinutes": 10,
      "difficulty": 4
    },
    {
      "id": "frontend.js-fundamentals.topic-607-5ceefc1c.code.3",
      "prompt": "请手写一个防抖(debounce)函数",
      "mode": "code",
      "expectedMinutes": 10,
      "difficulty": 2
    },
    {
      "id": "frontend.js-fundamentals.topic-607-5ceefc1c.code.4",
      "prompt": "请手写一个节流(throttle)函数",
      "mode": "code",
      "expectedMinutes": 10,
      "difficulty": 2
    }
  ],
  "rubric": {
    "mustHave": [
      "Promise三种状态及转换规则",
      "构造函数中executor的执行时机",
      "then方法返回新Promise的原因",
      "异步回调的存储和执行机制",
      "微任务执行方式"
    ],
    "goodToHave": [
      "resolve传入Promise的递归处理",
      "手写代码能跑通基本用例"
    ],
    "commonMistakes": [
      "不清楚Promise的三种状态（pending/fulfilled/rejected）",
      "忘记Promise.all和Promise.race的区别",
      "在async函数中忘记处理异常"
    ],
    "scoreWeights": {
      "coverage": 35,
      "accuracy": 30,
      "interviewExpression": 20,
      "depth": 15
    }
  },
  "prerequisites": [
    "frontend.js-fundamentals.closure-scope"
  ],
  "interviewFrequency": "medium",
  "interviewerFocus": "考察前端基础功底，是否理解浏览器/JS引擎的工作机制，能否手写核心实现"
}