{
  "id": "design-pattern.creational.topic-gong-chang-mo-shi",
  "domain": "design-pattern",
  "category": "creational",
  "group": "creational",
  "title": "工厂模式",
  "summary": "通过工厂方法创建对象，将对象的创建与使用分离，是实现开闭原则的重要手段。",
  "tags": [
    "设计模式",
    "创建型模式",
    "工厂模式"
  ],
  "difficulty": 2,
  "estimatedMinutes": 20,
  "order": 20,
  "recommendWeight": 85,
  "status": "draft",
  "learningCards": [
    {
      "type": "explain",
      "title": "知识全景",
      "content": "工厂模式是最常用的设计模式之一，它将对象的创建过程封装起来，客户端无需知道具体创建细节。工厂模式分为三种：\n\n1. **简单工厂**：一个工厂类根据参数创建不同产品，违反开闭原则\n2. **工厂方法**：每个产品对应一个工厂，符合开闭原则，但类数量增多\n3. **抽象工厂**：创建一系列相关产品，适合产品族场景\n\n工厂模式在Spring中有广泛应用，如BeanFactory、FactoryBean等。它体现了开闭原则：对扩展开放，对修改关闭。"
    },
    {
      "type": "code",
      "title": "代码示例",
      "content": "// 1. 简单工厂\npublic class SimpleFactory {\n    public static Product createProduct(String type) {\n        if (\"A\".equals(type)) {\n            return new ProductA();\n        } else if (\"B\".equals(type)) {\n            return new ProductB();\n        }\n        throw new IllegalArgumentException(\"Unknown type: \" + type);\n    }\n}\n\n// 2. 工厂方法\npublic interface Factory {\n    Product create();\n}\npublic class FactoryA implements Factory {\n    @Override\n    public Product create() {\n        return new ProductA();\n    }\n}\npublic class FactoryB implements Factory {\n    @Override\n    public Product create() {\n        return new ProductB();\n    }\n}\n\n// 3. 抽象工厂\npublic interface AbstractFactory {\n    ProductA createProductA();\n    ProductB createProductB();\n}\npublic class ConcreteFactory1 implements AbstractFactory {\n    @Override\n    public ProductA createProductA() {\n        return new ProductA1();\n    }\n    @Override\n    public ProductB createProductB() {\n        return new ProductB1();\n    }\n}",
      "language": "java"
    },
    {
      "type": "interviewAnswer",
      "title": "面试回答模板",
      "content": "面试官您好，工厂模式将对象的创建与使用分离，客户端不需要知道具体创建细节。它分为三种：\n\n简单工厂通过一个工厂类根据参数创建不同产品，优点是简单，缺点是每增加产品都要修改工厂类，违反开闭原则。\n\n工厂方法为每个产品提供对应的工厂类，符合开闭原则，新增产品只需新增工厂，但会导致类数量增多。\n\n抽象工厂用于创建一系列相关产品，比如不同风格的UI组件族。它适合产品族场景，但新增产品类型比较困难。\n\nSpring中大量使用工厂模式，比如BeanFactory是工厂方法模式，FactoryBean是抽象工厂的应用。工厂模式的核心价值是解耦和符合开闭原则。",
      "followUpQuestions": [
        {
          "question": "工厂模式的UML类图是怎样的？核心抽象方法和具体实现分别是什么？",
          "answer": "这个问题可以从几个层面来回答。三种工厂模式区别。工厂方法vs抽象工厂。Spring中的工厂模式。把这些要点串起来，就能给面试官一个有深度的回答。"
        },
        {
          "question": "实际项目中，简单工厂和工厂方法你会怎么选？能结合具体场景说说吗？",
          "answer": "选型要看具体场景。以维度为例，维度：简单工厂 vs 工厂方法；工厂类数量：1个 vs 多个；产品等级：单一产品 vs 单一产品。关键不是哪个绝对更好，而是根据业务场景的约束条件做出合理选择，并能说清楚trade-off。"
        },
        {
          "question": "有人说\"混淆工厂方法和抽象工厂\"，这种说法对吗？为什么？",
          "answer": "面试官确实喜欢从这个角度追问。常见误区有：混淆工厂方法和抽象工厂；认为简单工厂是设计模式。回答时不要只是说\"这是错的\"，要解释为什么错、正确的做法是什么，最好能结合具体代码或场景。"
        }
      ]
    },
    {
      "type": "compareTable",
      "title": "对比与边界",
      "content": "| 维度 | 简单工厂 | 工厂方法 | 抽象工厂 |\n| ------ | ---------- | ---------- | ---------- |\n| 工厂类数量 | 1个 | 多个 | 1个抽象+多个具体 |\n| 产品等级 | 单一产品 | 单一产品 | 产品族 |\n| 开闭原则 | 违反 | 符合 | 部分符合 |\n| 复杂度 | 低 | 中 | 高 |\n| 扩展性 | 差 | 好 | 中 |\n| Spring应用 | BeanFactory | FactoryBean | BeanFactory |\n| 适用场景 | 产品种类少 | 产品种类多 | 产品族场景 |"
    },
    {
      "type": "diagram",
      "title": "结构图解",
      "content": "工厂模式的核心是将对象创建过程封装，客户端只依赖接口。",
      "fallback": "工厂模式类图：Creator接口，ConcreteCreator实现，Product接口，ConcreteProduct实现",
      "items": [
        "1. 客户端依赖抽象工厂接口",
        "2. 具体工厂实现创建逻辑",
        "3. 产品接口定义业务方法",
        "4. 具体产品实现业务逻辑",
        "5. Spring容器充当超级工厂"
      ]
    },
    {
      "type": "checklist",
      "title": "学完后应能说清楚",
      "items": [
        "三种工厂模式的区别和适用场景",
        "工厂方法vs抽象工厂的核心差异",
        "Spring中BeanFactory和FactoryBean的区别",
        "工厂模式如何体现开闭原则",
        "何时选择简单工厂而非工厂方法"
      ]
    }
  ],
  "recallPrompts": [
    {
      "id": "design-pattern.creational.topic-gong-chang-mo-shi.recall.1",
      "prompt": "面试官问你：Spring中的BeanFactory和FactoryBean有什么区别？分别用在什么场景？",
      "mode": "text",
      "expectedMinutes": 3,
      "difficulty": 3
    },
    {
      "id": "design-pattern.creational.topic-gong-chang-mo-shi.recall.2",
      "prompt": "假设你需要设计一个支持多种数据库（MySQL、PostgreSQL、Oracle）的数据访问层，你会选择哪种工厂模式？为什么？",
      "mode": "text",
      "expectedMinutes": 3,
      "difficulty": 2
    }
  ],
  "rubric": {
    "mustHave": [
      "三种工厂模式区别",
      "工厂方法vs抽象工厂",
      "Spring中的工厂模式",
      "开闭原则体现",
      "适用场景"
    ],
    "goodToHave": [
      "工厂模式与依赖注入的关系",
      "工厂模式在框架源码中的应用"
    ],
    "commonMistakes": [
      "混淆工厂方法和抽象工厂",
      "认为简单工厂是设计模式"
    ],
    "scoreWeights": {
      "coverage": 35,
      "accuracy": 30,
      "interviewExpression": 20,
      "depth": 15
    }
  },
  "prerequisites": [
    "design-pattern.creational.topic-dan-li-mo-shi"
  ]
}
